<?xml version="1.0" encoding="iso-8859-1" standalone="no"?>
<!DOCTYPE testsuite SYSTEM "../../testsuite/lydia_tests.dtd">

<testsuite>

  <separator>Basic Tests:</separator>
  <test>
    <title>empty hierarchy</title>
    <input>empty.hwff</input>
    <output>empty.hcnf</output>
  </test>
  <test>
    <title>empty system</title>
    <input>realempty.hwff</input>
    <output>realempty.hcnf</output>
  </test>
  <test>
    <title>basic array expressions</title>
    <input>basic_arrays.hwff</input>
    <output>basic_arrays.hcnf</output>
  </test>

  <separator>Arithmetic Circuits Flat Tests:</separator>
  <test>
    <title>Boolean polycell</title>
    <input>polycell.wff</input>
    <output>polycell.cnf</output>
  </test>

  <separator>Arithmetic Circuits (WFM):</separator>
  <test>
    <title>2 chained inverters</title>
    <input>2inverters.hwff</input>
    <output>2inverters.hcnf</output>
  </test>
  <test>
    <title>3 inverters</title>
    <input>3inverters.hwff</input>
    <output>3inverters.hcnf</output>
  </test>
  <test>
    <title>4 chained inverters</title>
    <input>4inverters.hwff</input>
    <output>4inverters.hcnf</output>
  </test>
  <test>
    <title>10 chained inverters</title>
    <input>10inverters.hwff</input>
    <output>10inverters.hcnf</output>
  </test>
  <test>
    <title>Boolean polycell</title>
    <input>polycell.hwff</input>
    <output>polycell.hcnf</output>
  </test>
  <test>
    <title>1-bit full adder</title>
    <input>2adder-weak.hwff</input>
    <output>2adder-weak.hcnf</output>
  </test>
  <test>
    <title>1-bit subtractor</title>
    <input>2subtractor.hwff</input>
    <output>2subtractor.hcnf</output>
  </test>
  <test>
    <title>3 inverters and an AND gate</title>
    <input>inverted-and.hwff</input>
    <output>inverted-and.hcnf</output>
  </test>
  <test>
    <title>74182</title>
    <input>74182.hwff</input>
    <output>74182.hcnf</output>
  </test>
  <test>
    <title>74L85</title>
    <input>74L85.hwff</input>
    <output>74L85.hcnf</output>
  </test>
  <test>
    <title>74283</title>
    <input>74283.hwff</input>
    <output>74283.hcnf</output>
  </test>
  <test>
    <title>74181</title>
    <input>74181.hwff</input>
    <output>74181.hcnf</output>
  </test>

  <separator>Arithmetic Circuits (SFM):</separator>
  <test>
    <title>1-bit full adder</title>
    <input>2adder-strong.hwff</input>
    <output>2adder-strong.hcnf</output>
  </test>

  <separator>Modelling Tests:</separator>
  <test>
    <title>copier</title>
    <input>copier.hwff</input>
    <output>copier.hcnf</output>
  </test>
  <test>
    <title>stereo</title>
    <input>stereo.hwff</input>
    <output>stereo.hcnf</output>
  </test>

  <separator>Regression Tests:</separator>
  <test>
    <title>issue 110</title>
    <input>issue110.hwff</input>
    <output>issue110.hcnf</output>
  </test>
</testsuite>
    